id,categorie,nom,prix,promo,selection_moment,description,photos,statut
hom-001,hommes,Veste en laine vintage,"89,00 €","69,00 €",oui,"Veste seconde main sélectionnée pour sa coupe et son tombé intemporel.","assets/images/hommes.jpg|assets/images/hero.png",disponible
hom-002,hommes,Manteau classique,"119,00 €",,oui,"Manteau homme à l'allure sobre, idéal pour une silhouette élégante.","assets/images/hommes.jpg",disponible
fem-001,femmes,Sac en cuir vintage,"129,00 €",,oui,"Sac en cuir au caractère affirmé, choisi pour sa patine et sa tenue.","assets/images/femmes.png|assets/images/accessoires.png",disponible
fem-002,femmes,Blazer intemporel,"79,00 €","59,00 €",oui,"Blazer femme facile à porter, sélectionné pour sa ligne et son élégance.","assets/images/femmes.png|assets/images/hero.png",disponible
acc-001,accessoires,Chaîne plaqué or vintage,"45,00 €",,oui,"Chaîne dorée vintage, discrète et lumineuse.","assets/images/logo_fripperie2.png|assets/images/accessoires.png",disponible
acc-002,accessoires,Lunettes de caractère,"59,00 €",,oui,"Accessoire fort pour signer une silhouette avec subtilité.","assets/images/accessoires.png",disponible
